{
  "metadata": {
    "name": "Intercom",
    "kind": "intercom",
    "description": "Connect to Intercom API to manage contacts, conversations, tickets, companies, articles, and more.",
    "operationsMode": "api-endpoint",
    "specUrl": "@spec/intercom/intercom"
  },
  "auth": {
    "type": "bearer"
  },
  "schemaVersion": "v1",
  "operations": [
    {
      "name": "identify_an_admin",
      "displayName": "Identify an admin",
      "description": "GET /me (Admins)",
      "parameters": [
        {
          "name": "placeholder",
          "type": "string",
          "required": false,
          "description": "No required parameters"
        }
      ]
    },
    {
      "name": "set_an_admin_to_away",
      "displayName": "Set an admin to away",
      "description": "PUT /admins/{admin_id}/away (Admins)",
      "parameters": [
        {
          "name": "admin_id",
          "type": "string",
          "required": true,
          "description": "Path parameter: admin_id"
        }
      ]
    },
    {
      "name": "list_all_activity_logs",
      "displayName": "List all activity logs",
      "description": "GET /admins/activity_logs (Admins)",
      "parameters": [
        {
          "name": "placeholder",
          "type": "string",
          "required": false,
          "description": "No required parameters"
        }
      ]
    },
    {
      "name": "list_all_admins",
      "displayName": "List all admins",
      "description": "GET /admins (Admins)",
      "parameters": [
        {
          "name": "placeholder",
          "type": "string",
          "required": false,
          "description": "No required parameters"
        }
      ]
    },
    {
      "name": "retrieve_an_admin",
      "displayName": "Retrieve an admin",
      "description": "GET /admins/{admin_id} (Admins)",
      "parameters": [
        {
          "name": "admin_id",
          "type": "string",
          "required": true,
          "description": "Path parameter: admin_id"
        }
      ]
    },
    {
      "name": "list_content_import_sources",
      "displayName": "List content import sources",
      "description": "GET /ai/content_import_sources (AI Content)",
      "parameters": [
        {
          "name": "placeholder",
          "type": "string",
          "required": false,
          "description": "No required parameters"
        }
      ]
    },
    {
      "name": "create_a_content_import_source",
      "displayName": "Create a content import source",
      "description": "POST /ai/content_import_sources (AI Content)",
      "parameters": [
        {
          "name": "placeholder",
          "type": "string",
          "required": false,
          "description": "No required parameters"
        }
      ]
    },
    {
      "name": "delete_a_content_import_source",
      "displayName": "Delete a content import source",
      "description": "DELETE /ai/content_import_sources/{source_id} (AI Content)",
      "parameters": [
        {
          "name": "source_id",
          "type": "string",
          "required": true,
          "description": "Path parameter: source_id"
        }
      ]
    },
    {
      "name": "retrieve_a_content_import_source",
      "displayName": "Retrieve a content import source",
      "description": "GET /ai/content_import_sources/{source_id} (AI Content)",
      "parameters": [
        {
          "name": "source_id",
          "type": "string",
          "required": true,
          "description": "Path parameter: source_id"
        }
      ]
    },
    {
      "name": "update_a_content_import_source",
      "displayName": "Update a content import source",
      "description": "PUT /ai/content_import_sources/{source_id} (AI Content)",
      "parameters": [
        {
          "name": "source_id",
          "type": "string",
          "required": true,
          "description": "Path parameter: source_id"
        }
      ]
    },
    {
      "name": "list_external_pages",
      "displayName": "List external pages",
      "description": "GET /ai/external_pages (AI Content)",
      "parameters": [
        {
          "name": "placeholder",
          "type": "string",
          "required": false,
          "description": "No required parameters"
        }
      ]
    },
    {
      "name": "create_an_external_page_or_update_an_external_page_by_external_id",
      "displayName": "Create an external page (or update an external page by external ID)",
      "description": "POST /ai/external_pages (AI Content)",
      "parameters": [
        {
          "name": "placeholder",
          "type": "string",
          "required": false,
          "description": "No required parameters"
        }
      ]
    },
    {
      "name": "delete_an_external_page",
      "displayName": "Delete an external page",
      "description": "DELETE /ai/external_pages/{page_id} (AI Content)",
      "parameters": [
        {
          "name": "page_id",
          "type": "string",
          "required": true,
          "description": "Path parameter: page_id"
        }
      ]
    },
    {
      "name": "retrieve_an_external_page",
      "displayName": "Retrieve an external page",
      "description": "GET /ai/external_pages/{page_id} (AI Content)",
      "parameters": [
        {
          "name": "page_id",
          "type": "string",
          "required": true,
          "description": "Path parameter: page_id"
        }
      ]
    },
    {
      "name": "update_an_external_page",
      "displayName": "Update an external page",
      "description": "PUT /ai/external_pages/{page_id} (AI Content)",
      "parameters": [
        {
          "name": "page_id",
          "type": "string",
          "required": true,
          "description": "Path parameter: page_id"
        }
      ]
    },
    {
      "name": "list_all_articles",
      "displayName": "List all articles",
      "description": "GET /articles (Articles)",
      "parameters": [
        {
          "name": "placeholder",
          "type": "string",
          "required": false,
          "description": "No required parameters"
        }
      ]
    },
    {
      "name": "create_an_article",
      "displayName": "Create an article",
      "description": "POST /articles (Articles)",
      "parameters": [
        {
          "name": "placeholder",
          "type": "string",
          "required": false,
          "description": "No required parameters"
        }
      ]
    },
    {
      "name": "retrieve_an_article",
      "displayName": "Retrieve an article",
      "description": "GET /articles/{article_id} (Articles)",
      "parameters": [
        {
          "name": "article_id",
          "type": "string",
          "required": true,
          "description": "Path parameter: article_id"
        }
      ]
    },
    {
      "name": "update_an_article",
      "displayName": "Update an article",
      "description": "PUT /articles/{article_id} (Articles)",
      "parameters": [
        {
          "name": "article_id",
          "type": "string",
          "required": true,
          "description": "Path parameter: article_id"
        }
      ]
    },
    {
      "name": "delete_an_article",
      "displayName": "Delete an article",
      "description": "DELETE /articles/{article_id} (Articles)",
      "parameters": [
        {
          "name": "article_id",
          "type": "string",
          "required": true,
          "description": "Path parameter: article_id"
        }
      ]
    },
    {
      "name": "search_for_articles",
      "displayName": "Search for articles",
      "description": "GET /articles/search (Articles)",
      "parameters": [
        {
          "name": "placeholder",
          "type": "string",
          "required": false,
          "description": "No required parameters"
        }
      ]
    },
    {
      "name": "list_all_away_status_reasons",
      "displayName": "List all away status reasons",
      "description": "GET /away_status_reasons (Away Status Reasons)",
      "parameters": [
        {
          "name": "placeholder",
          "type": "string",
          "required": false,
          "description": "No required parameters"
        }
      ]
    },
    {
      "name": "enqueue_a_new_reporting_data_export_job",
      "displayName": "Enqueue a new reporting data export job",
      "description": "POST /export/reporting_data/enqueue",
      "parameters": [
        {
          "name": "placeholder",
          "type": "string",
          "required": false,
          "description": "No required parameters"
        }
      ]
    },
    {
      "name": "get_export_job_status",
      "displayName": "Get export job status",
      "description": "GET /export/reporting_data/{job_identifier}",
      "parameters": [
        {
          "name": "job_identifier",
          "type": "string",
          "required": true,
          "description": "Path parameter: job_identifier"
        }
      ]
    },
    {
      "name": "list_available_datasets_and_attributes",
      "displayName": "List available datasets and attributes",
      "description": "GET /export/reporting_data/get_datasets",
      "parameters": [
        {
          "name": "placeholder",
          "type": "string",
          "required": false,
          "description": "No required parameters"
        }
      ]
    },
    {
      "name": "download_completed_export_job_data",
      "displayName": "Download completed export job data",
      "description": "GET /download/reporting_data/{job_identifier}",
      "parameters": [
        {
          "name": "job_identifier",
          "type": "string",
          "required": true,
          "description": "Path parameter: job_identifier"
        }
      ]
    },
    {
      "name": "list_all_collections",
      "displayName": "List all collections",
      "description": "GET /help_center/collections (Help Center)",
      "parameters": [
        {
          "name": "placeholder",
          "type": "string",